{"$id":"rich-content-v2","$schema":"https://json-schema.org/draft/2020-12/schema","additionalProperties":false,"properties":{"id":{"const":"rich-content"},"owner":{"const":"core"},"readingParagraphEmphasis":{"const":{"mapping":"original UTF-16 coordinates through validated editorial edits; reject mixed-boundary edits and typography drift","marks":["bold","underline"],"scope":"Reading paragraph text only; omit whole-paragraph decoration independently per property","source":"direct DOCX run properties at the exact paragraph locator; no inferred or inherited styling"}},"schemaVersion":{"const":"rich-content-v2"},"table":{"additionalProperties":false,"properties":{"cellInlines":{"const":["text","blank_ref","media_ref"]},"grid":{"const":"columnStart and columnSpan cover every row exactly once after active rowSpan occupancy"},"mediaRef":{"const":"mediaId resolves within the same canonical question group; alt is required literal text"},"rowSpan":{"const":"integer >= 1; reserves every covered column in following rows and may not exceed the final row"}},"required":["grid","rowSpan","cellInlines","mediaRef"],"type":"object"},"version":{"const":"2"}},"required":["id","owner","schemaVersion","version","table","readingParagraphEmphasis"],"type":"object"}
