{"id":"rich-content","owner":"core","readingParagraphEmphasis":{"mapping":"original UTF-16 coordinates through validated editorial edits; reject mixed-boundary edits and typography drift","marks":["bold","underline"],"scope":"Reading paragraph text only; omit whole-paragraph decoration independently per property","source":"direct DOCX run properties at the exact paragraph locator; no inferred or inherited styling"},"schemaVersion":"rich-content-v2","table":{"cellInlines":["text","blank_ref","media_ref"],"grid":"columnStart and columnSpan cover every row exactly once after active rowSpan occupancy","mediaRef":"mediaId resolves within the same canonical question group; alt is required literal text","rowSpan":"integer >= 1; reserves every covered column in following rows and may not exceed the final row"},"version":"2"}
